{
  "schema": "kobra.engine-manifest/1",
  "release": "2026.09.1",
  "engine_version": "0.1.0",
  "wasm": "engine/game.wasm",
  "glue": "engine/game.js",
  "save_version": 1,
  "required_features": [
    "wasm"
  ],
  "min_browser": {
    "chrome": 105,
    "edge": 105,
    "opera": 91
  },
  "memory": {
    "initial_bytes": 65536,
    "maximum_bytes": 268435456
  },
  "notes": "Fixture engine: exports memory and tick(i32)->i32. No game logic, no rendering, no threading. engine_version and save_version deliberately match the launcher binary's compile-time constants so /api/state agrees with this document."
}
